{
  "artifacts": [
    {
      "path": "build/knowledge-graph/knowledge-graph.json",
      "recorded_at": "2026-09-08T10:21:31.500Z",
      "reusable": true,
      "sha256": null,
      "type": "graph",
      "url": null,
      "value": "build/knowledge-graph/knowledge-graph.json"
    },
    {
      "path": "build/knowledge-graph/knowledge-graph.graphml",
      "recorded_at": "2026-09-08T10:21:31.500Z",
      "reusable": true,
      "sha256": null,
      "type": "graph",
      "url": null,
      "value": "build/knowledge-graph/knowledge-graph.graphml"
    },
    {
      "path": "build/knowledge-graph/knowledge-graph.mmd",
      "recorded_at": "2026-09-08T10:21:31.500Z",
      "reusable": true,
      "sha256": null,
      "type": "graph",
      "url": null,
      "value": "build/knowledge-graph/knowledge-graph.mmd"
    },
    {
      "path": "build/knowledge-graph/graph-report.json",
      "recorded_at": "2026-09-08T10:21:31.500Z",
      "reusable": true,
      "sha256": null,
      "type": "graph",
      "url": null,
      "value": "build/knowledge-graph/graph-report.json"
    },
    {
      "path": "build/knowledge-graph/graph-report.md",
      "recorded_at": "2026-09-08T10:21:31.500Z",
      "reusable": true,
      "sha256": null,
      "type": "graph",
      "url": null,
      "value": "build/knowledge-graph/graph-report.md"
    },
    {
      "path": "build/ADHS-Lernpfad-Gesamtdokument.md",
      "recorded_at": "2026-09-08T10:21:38.727Z",
      "reusable": false,
      "sha256": null,
      "type": "other",
      "url": null,
      "value": "build/ADHS-Lernpfad-Gesamtdokument.md"
    },
    {
      "path": "site",
      "recorded_at": "2026-09-08T10:22:34.614Z",
      "reusable": true,
      "sha256": null,
      "type": "site",
      "url": null,
      "value": "site"
    }
  ],
  "completed_phases": [
    "load_content",
    "build_nodes",
    "build_edges",
    "validate_graph",
    "export",
    "complete"
  ],
  "context": {
    "branch": "main",
    "commit_sha": "473ed02812879abad42a9a4bd36a2825b633ceae",
    "pr_number": null,
    "pr_url": null,
    "repository": "H234598/ADHS-Lernpfad",
    "workflow_run": {
      "attempt": 1,
      "id": 34214901550,
      "job_id": "validate",
      "logs_url": "https://github.com/H234598/ADHS-Lernpfad/actions/runs/34214901550",
      "url": "https://github.com/H234598/ADHS-Lernpfad/actions/runs/34214901550"
    }
  },
  "created_at": "2026-09-08T10:20:27.411Z",
  "duration_seconds": 127.206,
  "ended_at": "2026-09-08T10:22:34.617Z",
  "error": null,
  "metrics": {
    "chapters": 21,
    "documents": 24,
    "edges": 965,
    "errors": 0,
    "missing_pages": 0,
    "node_types": {
      "chapter": 21,
      "concept": 120,
      "document": 13,
      "glossary": 1,
      "intro": 1,
      "planned": 5,
      "reference": 57,
      "section": 33,
      "technical": 22
    },
    "nodes": 273,
    "planned_pages": 5,
    "relations": {
      "cites": 89,
      "contains": 33,
      "planned_in": 5,
      "prerequisite": 66,
      "sequence": 20,
      "tagged_with": 497,
      "wikilink": 255
    },
    "sources": 57,
    "warnings": 0
  },
  "phase": "complete",
  "previous_status": "success",
  "recovery": null,
  "retention_until": "2026-10-08T10:22:34.617Z",
  "revision": 16,
  "run_id": "34214901550-1",
  "schema_version": "3.0.0",
  "status": "success",
  "updated_at": "2026-09-08T10:22:34.617Z",
  "workflow": "validate-graph-and-build"
}
