{
  "artifacts": [],
  "completed_phases": [
    "validate_graph",
    "complete"
  ],
  "context": {
    "branch": "feat/learning-card-policy-router",
    "commit_sha": "a502c3810e44e1696d9e7dcc286ff0e1aa316a6a",
    "pr_number": null,
    "pr_url": null,
    "repository": "H234598/ADHS-Lernpfad",
    "workflow_run": {
      "attempt": 1,
      "id": 33774458150,
      "job_id": "validate-runtime-status",
      "logs_url": "https://github.com/H234598/ADHS-Lernpfad/actions/runs/33774458150",
      "url": "https://github.com/H234598/ADHS-Lernpfad/actions/runs/33774458150"
    }
  },
  "created_at": "2026-09-03T15:45:12.064Z",
  "duration_seconds": 0.108,
  "ended_at": "2026-09-03T15:45:12.172Z",
  "error": null,
  "metrics": {},
  "phase": "complete",
  "previous_status": "running",
  "recovery": null,
  "retention_until": "2026-10-03T15:45:12.172Z",
  "revision": 3,
  "run_id": "33774458150-1",
  "schema_version": "3.0.0",
  "status": "success",
  "updated_at": "2026-09-03T15:45:12.172Z",
  "workflow": "runtime-contract"
}
