{
  "artifacts": [
    {
      "path": "build/knowledge-graph/knowledge-graph.json",
      "recorded_at": "2026-09-03T22:22:12.377Z",
      "reusable": true,
      "sha256": null,
      "type": "graph",
      "url": null,
      "value": "build/knowledge-graph/knowledge-graph.json"
    },
    {
      "path": "build/knowledge-graph/knowledge-graph.graphml",
      "recorded_at": "2026-09-03T22:22:12.377Z",
      "reusable": true,
      "sha256": null,
      "type": "graph",
      "url": null,
      "value": "build/knowledge-graph/knowledge-graph.graphml"
    },
    {
      "path": "build/knowledge-graph/knowledge-graph.mmd",
      "recorded_at": "2026-09-03T22:22:12.377Z",
      "reusable": true,
      "sha256": null,
      "type": "graph",
      "url": null,
      "value": "build/knowledge-graph/knowledge-graph.mmd"
    },
    {
      "path": "build/knowledge-graph/graph-report.json",
      "recorded_at": "2026-09-03T22:22:12.377Z",
      "reusable": true,
      "sha256": null,
      "type": "graph",
      "url": null,
      "value": "build/knowledge-graph/graph-report.json"
    },
    {
      "path": "build/knowledge-graph/graph-report.md",
      "recorded_at": "2026-09-03T22:22:12.377Z",
      "reusable": true,
      "sha256": null,
      "type": "graph",
      "url": null,
      "value": "build/knowledge-graph/graph-report.md"
    },
    {
      "path": "build/ADHS-Lernpfad-Gesamtdokument.md",
      "recorded_at": "2026-09-03T22:22:15.742Z",
      "reusable": false,
      "sha256": null,
      "type": "other",
      "url": null,
      "value": "build/ADHS-Lernpfad-Gesamtdokument.md"
    },
    {
      "path": "build/artifacts/ADHS-Lernpfad.pdf",
      "recorded_at": "2026-09-03T22:24:16.929Z",
      "reusable": true,
      "sha256": null,
      "type": "export",
      "url": null,
      "value": "build/artifacts/ADHS-Lernpfad.pdf"
    },
    {
      "path": "build/artifacts/ADHS-Lernpfad.epub",
      "recorded_at": "2026-09-03T22:24:16.929Z",
      "reusable": true,
      "sha256": null,
      "type": "export",
      "url": null,
      "value": "build/artifacts/ADHS-Lernpfad.epub"
    },
    {
      "path": "build/artifacts/ADHS-Lernpfad.html",
      "recorded_at": "2026-09-03T22:24:16.929Z",
      "reusable": true,
      "sha256": null,
      "type": "export",
      "url": null,
      "value": "build/artifacts/ADHS-Lernpfad.html"
    },
    {
      "path": "build/artifacts/ADHS-Lernpfad.tex",
      "recorded_at": "2026-09-03T22:24:16.929Z",
      "reusable": true,
      "sha256": null,
      "type": "export",
      "url": null,
      "value": "build/artifacts/ADHS-Lernpfad.tex"
    },
    {
      "path": "build/artifacts/ADHS-Lernpfad-Gesamtdokument.md",
      "recorded_at": "2026-09-03T22:24:16.929Z",
      "reusable": true,
      "sha256": null,
      "type": "export",
      "url": null,
      "value": "build/artifacts/ADHS-Lernpfad-Gesamtdokument.md"
    },
    {
      "path": "build/artifacts/ADHS-Lernpfad-Obsidian-Vault.zip",
      "recorded_at": "2026-09-03T22:24:16.929Z",
      "reusable": true,
      "sha256": null,
      "type": "export",
      "url": null,
      "value": "build/artifacts/ADHS-Lernpfad-Obsidian-Vault.zip"
    },
    {
      "path": "build/artifacts/ADHS-Lernpfad.apkg",
      "recorded_at": "2026-09-03T22:24:16.929Z",
      "reusable": true,
      "sha256": null,
      "type": "export",
      "url": null,
      "value": "build/artifacts/ADHS-Lernpfad.apkg"
    },
    {
      "path": "build/artifacts/references.bib",
      "recorded_at": "2026-09-03T22:24:16.929Z",
      "reusable": true,
      "sha256": null,
      "type": "export",
      "url": null,
      "value": "build/artifacts/references.bib"
    },
    {
      "path": "build/artifacts/references.json",
      "recorded_at": "2026-09-03T22:24:16.929Z",
      "reusable": true,
      "sha256": null,
      "type": "export",
      "url": null,
      "value": "build/artifacts/references.json"
    },
    {
      "path": "build/artifacts/ADHS-Lernpfad-Sync-Linux.zip",
      "recorded_at": "2026-09-03T22:24:16.929Z",
      "reusable": true,
      "sha256": null,
      "type": "export",
      "url": null,
      "value": "build/artifacts/ADHS-Lernpfad-Sync-Linux.zip"
    },
    {
      "path": "build/artifacts/ADHS-Lernpfad-Sync-Android.zip",
      "recorded_at": "2026-09-03T22:24:16.929Z",
      "reusable": true,
      "sha256": null,
      "type": "export",
      "url": null,
      "value": "build/artifacts/ADHS-Lernpfad-Sync-Android.zip"
    },
    {
      "path": "build/artifacts/ADHS-Lernpfad-Sync-Windows.zip",
      "recorded_at": "2026-09-03T22:24:16.929Z",
      "reusable": true,
      "sha256": null,
      "type": "export",
      "url": null,
      "value": "build/artifacts/ADHS-Lernpfad-Sync-Windows.zip"
    },
    {
      "path": "build/artifacts/ADHS-Lernpfad-Sync-macOS.zip",
      "recorded_at": "2026-09-03T22:24:16.929Z",
      "reusable": true,
      "sha256": null,
      "type": "export",
      "url": null,
      "value": "build/artifacts/ADHS-Lernpfad-Sync-macOS.zip"
    },
    {
      "path": "build/artifacts/ADHS-Lernpfad-Sync-iOS.zip",
      "recorded_at": "2026-09-03T22:24:16.929Z",
      "reusable": true,
      "sha256": null,
      "type": "export",
      "url": null,
      "value": "build/artifacts/ADHS-Lernpfad-Sync-iOS.zip"
    },
    {
      "path": "build/artifacts/ADHS-Lernpfad-Sync-BSD.zip",
      "recorded_at": "2026-09-03T22:24:16.929Z",
      "reusable": true,
      "sha256": null,
      "type": "export",
      "url": null,
      "value": "build/artifacts/ADHS-Lernpfad-Sync-BSD.zip"
    },
    {
      "path": "build/artifacts/knowledge-graph.json",
      "recorded_at": "2026-09-03T22:24:16.929Z",
      "reusable": true,
      "sha256": null,
      "type": "graph",
      "url": null,
      "value": "build/artifacts/knowledge-graph.json"
    },
    {
      "path": "build/artifacts/knowledge-graph.graphml",
      "recorded_at": "2026-09-03T22:24:16.929Z",
      "reusable": true,
      "sha256": null,
      "type": "graph",
      "url": null,
      "value": "build/artifacts/knowledge-graph.graphml"
    },
    {
      "path": "build/artifacts/knowledge-graph.mmd",
      "recorded_at": "2026-09-03T22:24:16.929Z",
      "reusable": true,
      "sha256": null,
      "type": "graph",
      "url": null,
      "value": "build/artifacts/knowledge-graph.mmd"
    },
    {
      "path": "build/artifacts/graph-report.md",
      "recorded_at": "2026-09-03T22:24:16.929Z",
      "reusable": true,
      "sha256": null,
      "type": "graph",
      "url": null,
      "value": "build/artifacts/graph-report.md"
    },
    {
      "path": "build/artifacts/graph-report.json",
      "recorded_at": "2026-09-03T22:24:16.929Z",
      "reusable": true,
      "sha256": null,
      "type": "graph",
      "url": null,
      "value": "build/artifacts/graph-report.json"
    },
    {
      "path": "build/artifacts/runtime-status.json",
      "recorded_at": "2026-09-03T22:24:16.929Z",
      "reusable": true,
      "sha256": null,
      "type": "export",
      "url": null,
      "value": "build/artifacts/runtime-status.json"
    },
    {
      "path": "build/artifacts/downloads.json",
      "recorded_at": "2026-09-03T22:24:16.929Z",
      "reusable": true,
      "sha256": null,
      "type": "export",
      "url": null,
      "value": "build/artifacts/downloads.json"
    },
    {
      "path": "build/artifacts/SHA256SUMS.txt",
      "recorded_at": "2026-09-03T22:24:16.929Z",
      "reusable": true,
      "sha256": null,
      "type": "export",
      "url": null,
      "value": "build/artifacts/SHA256SUMS.txt"
    }
  ],
  "completed_phases": [
    "load_content",
    "build_nodes",
    "build_edges",
    "validate_graph",
    "export",
    "complete"
  ],
  "context": {
    "branch": "main",
    "commit_sha": "a556fed9b1307f1316c34521252c07e8998f076d",
    "pr_number": null,
    "pr_url": null,
    "repository": "H234598/ADHS-Lernpfad",
    "workflow_run": {
      "attempt": 1,
      "id": 33812691750,
      "job_id": "export",
      "logs_url": "https://github.com/H234598/ADHS-Lernpfad/actions/runs/33812691750",
      "url": "https://github.com/H234598/ADHS-Lernpfad/actions/runs/33812691750"
    }
  },
  "created_at": "2026-09-03T22:22:05.910Z",
  "duration_seconds": 131.103,
  "ended_at": "2026-09-03T22:24:17.013Z",
  "error": null,
  "metrics": {
    "chapters": 20,
    "documents": 23,
    "edges": 899,
    "errors": 0,
    "missing_pages": 0,
    "node_types": {
      "chapter": 20,
      "concept": 107,
      "document": 13,
      "glossary": 1,
      "intro": 1,
      "planned": 5,
      "reference": 53,
      "section": 33,
      "technical": 22
    },
    "nodes": 255,
    "planned_pages": 5,
    "relations": {
      "cites": 82,
      "contains": 33,
      "planned_in": 5,
      "prerequisite": 63,
      "sequence": 19,
      "tagged_with": 455,
      "wikilink": 242
    },
    "sources": 53,
    "warnings": 0
  },
  "phase": "complete",
  "previous_status": "running",
  "recovery": null,
  "retention_until": "2026-10-03T22:24:17.013Z",
  "revision": 17,
  "run_id": "33812691750-1",
  "schema_version": "3.0.0",
  "status": "success",
  "updated_at": "2026-09-03T22:24:17.013Z",
  "workflow": "public-exports"
}
