{
  "artifacts": [],
  "completed_phases": [
    "check_previous_run",
    "complete"
  ],
  "context": {
    "branch": "main",
    "commit_sha": "28c2770b0920761f9f2c315f79b1559dbffe11db",
    "pr_number": null,
    "pr_url": null,
    "repository": "H234598/ADHS-Lernpfad",
    "workflow_run": {
      "attempt": 1,
      "id": 30357183833,
      "job_id": "bootstrap",
      "logs_url": "https://github.com/H234598/ADHS-Lernpfad/actions/runs/30357183833",
      "url": "https://github.com/H234598/ADHS-Lernpfad/actions/runs/30357183833"
    }
  },
  "created_at": "2026-07-28T12:01:53.463Z",
  "duration_seconds": 0.199,
  "ended_at": "2026-07-28T12:01:53.662Z",
  "error": null,
  "metrics": {},
  "phase": "complete",
  "previous_status": "running",
  "recovery": null,
  "retention_until": "2026-08-27T12:01:53.662Z",
  "revision": 3,
  "run_id": "bootstrap-20260728T120000Z",
  "schema_version": "3.0.0",
  "status": "success",
  "updated_at": "2026-07-28T12:01:53.662Z",
  "workflow": "generator"
}
