{"schema_version":"3.0.0","run_id":"a3876fd1-e1cf-4584-b2e8-92f731e5a4fe","workflow":"generator","revision":12,"previous_status":"running","status":"running","phase":"wait_review","completed_phases":["initialize","load_main","check_previous_run","check_existing_pr","read_prompts","research","create_branch","create_content","generate_outputs","validate","commit","push","create_pr","verify_pr","wait_review","ready_for_review","repair"],"created_at":"2026-09-03T22:31:00Z","updated_at":"2026-09-07T04:07:00Z","ended_at":null,"duration_seconds":null,"retention_until":"2026-10-03T22:31:00Z","context":{"repository":"H234598/ADHS-Lernpfad","branch":"agent/einheit-21-lern-sprache-intellektuelle-entwicklung","commit_sha":"e4be8c6d5470e53e4aa427ba6554451165f2b065","pr_number":66,"pr_url":"https://github.com/H234598/ADHS-Lernpfad/pull/66","workflow_run":{"id":34081745487,"attempt":1,"job_id":null,"url":"https://github.com/H234598/ADHS-Lernpfad/actions/runs/34081745487","logs_url":"https://github.com/H234598/ADHS-Lernpfad/actions/runs/34081745487"}},"metrics":{"unit_number":21,"prose_words":1763,"automatic_unit_pull_request_open":true,"draft_pull_request":66,"new_content_required":false,"current_main_commit":"ec9e1d874a9262ad0d59e1be042240e2a30fb576","historical_pr":62,"historical_merge_commit":"8b0afe944a88aa8464016b138bca31ee52b9e1e9","historical_merged_at":"2026-09-03T23:39:58Z","historical_merge_policy_violation":true,"historical_second_ci_complete_before_merge":false,"historical_coderabbit_hard_gate_before_merge":"failure","historical_learning_card_gate_before_merge":"not_success","recovery_started":true,"recovery_diff_files":4,"recovery_evidence_rechecked":true,"recovery_pr":66,"recovery_pr_created_at":"2026-09-05T04:04:51Z","recovery_review_eligible_at":"2026-09-05T06:04:51Z","recovery_repair_eligible_at":"2026-09-05T18:00:00Z","recovery_head":"e4be8c6d5470e53e4aa427ba6554451165f2b065","recovery_first_validate":"failure_run_33943591410","recovery_first_remark":"success_run_33943591359","recovery_first_coderabbit":"success","recovery_primary_failure":"resolved_generated_literature_last_reviewed","recovery_tests":"242_passed_41_subtests","recovery_npm_test":"success","branch_still_exists":true,"next_generator_blocked":true,"recovery_second_repair_started":"2026-09-06T04:03:00Z","recovery_second_repair_reason":"regenerate_literature_last_reviewed","recovery_second_repair_intermediate_commit":"631f439b3272ceb8c6674745fc5dd45e0ffcb388","recovery_second_repair_commit":"55ab93a102f4820f3d20d0836ac2c1971af7506f","recovery_second_validate":"success_run_34010731126","recovery_second_remark":"success_run_34010731004","recovery_second_codacy":"success_run_34010731053","recovery_second_coderabbit":"content_scope_failure","recovery_failure_fingerprint":"awaiting_ci_and_coderabbit_after_content_scope_fix","recovery_third_repair_started":"2026-09-07T03:59:00Z","recovery_third_repair_reason":"restore_learning_disorder_differential_boundary","recovery_third_repair_commit":"e4be8c6d5470e53e4aa427ba6554451165f2b065","recovery_third_repair_changed_files":2,"recovery_third_research":"who_cddr_and_current_icd11_learning_boundary_rechecked","recovery_third_validate":"in_progress_run_34081745487","recovery_third_remark":"success_run_34081745532","recovery_third_codacy":"in_progress_run_34081745490","recovery_third_coderabbit":"pending","coderabbit_disagreement":false},"artifacts":[{"type":"branch","value":"agent/einheit-21-lern-sprache-intellektuelle-entwicklung","path":null,"url":"https://github.com/H234598/ADHS-Lernpfad/tree/agent/einheit-21-lern-sprache-intellektuelle-entwicklung","sha256":null,"reusable":true,"recorded_at":"2026-09-03T22:53:00Z"},{"type":"commit","value":"176785f3e6c9c6314249c33c9c7ec7d4b91dda18","path":null,"url":"https://github.com/H234598/ADHS-Lernpfad/commit/176785f3e6c9c6314249c33c9c7ec7d4b91dda18","sha256":null,"reusable":true,"recorded_at":"2026-09-03T23:28:45Z"},{"type":"pull_request","value":"#62","path":null,"url":"https://github.com/H234598/ADHS-Lernpfad/pull/62","sha256":null,"reusable":true,"recorded_at":"2026-09-03T22:50:58Z"},{"type":"ci_job","value":"CodeRabbit review gate (blocking): failure on final head","path":null,"url":"https://github.com/H234598/ADHS-Lernpfad/actions/runs/33818274693/job/100855064230","sha256":null,"reusable":false,"recorded_at":"2026-09-03T23:36:01Z"},{"type":"report","value":"CodeRabbit pre-merge review: claim-source entailment unresolved","path":null,"url":"https://github.com/H234598/ADHS-Lernpfad/pull/62#issuecomment-5533153087","sha256":null,"reusable":true,"recorded_at":"2026-09-03T23:39:56Z"},{"type":"commit","value":"8b0afe944a88aa8464016b138bca31ee52b9e1e9","path":null,"url":"https://github.com/H234598/ADHS-Lernpfad/commit/8b0afe944a88aa8464016b138bca31ee52b9e1e9","sha256":null,"reusable":true,"recorded_at":"2026-09-03T23:39:58Z"},{"type":"commit","value":"0728f24e09d75bcb6378e5f12c9de853ac11818a","path":null,"url":"https://github.com/H234598/ADHS-Lernpfad/commit/0728f24e09d75bcb6378e5f12c9de853ac11818a","sha256":null,"reusable":true,"recorded_at":"2026-09-05T04:07:00Z"},{"type":"pull_request","value":"#66","path":null,"url":"https://github.com/H234598/ADHS-Lernpfad/pull/66","sha256":null,"reusable":true,"recorded_at":"2026-09-05T04:04:51Z"},{"type":"workflow_run","value":"33943591410","path":null,"url":"https://github.com/H234598/ADHS-Lernpfad/actions/runs/33943591410","sha256":null,"reusable":true,"recorded_at":"2026-09-05T04:06:06Z"},{"type":"workflow_run","value":"33943591359","path":null,"url":"https://github.com/H234598/ADHS-Lernpfad/actions/runs/33943591359","sha256":null,"reusable":true,"recorded_at":"2026-09-05T04:06:00Z"},{"type":"report","value":"PR #66 recovery CI diagnosis","path":null,"url":"https://github.com/H234598/ADHS-Lernpfad/pull/66#issuecomment-5549235591","sha256":null,"reusable":true,"recorded_at":"2026-09-05T04:11:00Z"},{"type":"commit","value":"631f439b3272ceb8c6674745fc5dd45e0ffcb388","path":null,"url":"https://github.com/H234598/ADHS-Lernpfad/commit/631f439b3272ceb8c6674745fc5dd45e0ffcb388","sha256":null,"reusable":true,"recorded_at":"2026-09-06T04:06:29Z"},{"type":"commit","value":"55ab93a102f4820f3d20d0836ac2c1971af7506f","path":null,"url":"https://github.com/H234598/ADHS-Lernpfad/commit/55ab93a102f4820f3d20d0836ac2c1971af7506f","sha256":null,"reusable":true,"recorded_at":"2026-09-06T04:08:08Z"},{"type":"workflow_run","value":"34010731126","path":null,"url":"https://github.com/H234598/ADHS-Lernpfad/actions/runs/34010731126","sha256":null,"reusable":true,"recorded_at":"2026-09-06T04:09:00Z"},{"type":"workflow_run","value":"34010731004","path":null,"url":"https://github.com/H234598/ADHS-Lernpfad/actions/runs/34010731004","sha256":null,"reusable":true,"recorded_at":"2026-09-06T04:09:00Z"},{"type":"report","value":"PR #66 deterministic literature repair","path":null,"url":"https://github.com/H234598/ADHS-Lernpfad/pull/66#issuecomment-5556804092","sha256":null,"reusable":true,"recorded_at":"2026-09-06T04:10:00Z"},{"type":"workflow_run","value":"34010731053","path":null,"url":"https://github.com/H234598/ADHS-Lernpfad/actions/runs/34010731053","sha256":null,"reusable":true,"recorded_at":"2026-09-07T03:59:00Z"},{"type":"report","value":"CodeRabbit Content-Scope: Lernstoerungs-Abgrenzung wiederherstellen","path":null,"url":"https://github.com/H234598/ADHS-Lernpfad/pull/66#issuecomment-5549230103","sha256":null,"reusable":true,"recorded_at":"2026-09-07T03:59:00Z"},{"type":"commit","value":"e4be8c6d5470e53e4aa427ba6554451165f2b065","path":null,"url":"https://github.com/H234598/ADHS-Lernpfad/commit/e4be8c6d5470e53e4aa427ba6554451165f2b065","sha256":null,"reusable":true,"recorded_at":"2026-09-07T04:05:20Z"},{"type":"report","value":"PR #66 Content-Scope recovery repair","path":null,"url":"https://github.com/H234598/ADHS-Lernpfad/pull/66#issuecomment-5564862845","sha256":null,"reusable":true,"recorded_at":"2026-09-07T04:05:20Z"},{"type":"workflow_run","value":"34081745487","path":null,"url":"https://github.com/H234598/ADHS-Lernpfad/actions/runs/34081745487","sha256":null,"reusable":true,"recorded_at":"2026-09-07T04:07:00Z"},{"type":"workflow_run","value":"34081745532","path":null,"url":"https://github.com/H234598/ADHS-Lernpfad/actions/runs/34081745532","sha256":null,"reusable":true,"recorded_at":"2026-09-07T04:07:00Z"},{"type":"workflow_run","value":"34081745490","path":null,"url":"https://github.com/H234598/ADHS-Lernpfad/actions/runs/34081745490","sha256":null,"reusable":true,"recorded_at":"2026-09-07T04:07:00Z"}],"error":null,"recovery":null}