{
  "schema_version": "3.0.0",
  "run_id": "3de09baa-799c-4323-87d2-067b749b2012",
  "workflow": "generator",
  "revision": 5,
  "previous_status": "running",
  "status": "running",
  "phase": "wait_review",
  "completed_phases": [
    "initialize",
    "load_main",
    "check_previous_run",
    "check_existing_pr",
    "read_prompts",
    "research",
    "create_branch",
    "create_content",
    "generate_outputs",
    "validate",
    "commit",
    "push",
    "create_pr",
    "verify_pr"
  ],
  "created_at": "2026-08-02T04:01:21.000Z",
  "updated_at": "2026-08-02T04:45:00.000Z",
  "ended_at": null,
  "duration_seconds": null,
  "retention_until": "2026-09-01T04:45:00.000Z",
  "context": {
    "repository": "H234598/ADHS-Lernpfad",
    "branch": "agent/einheit-18-trauma-ptbs-komplexe-traumafolgen",
    "commit_sha": "158957f90496c56cd91b60f96c52ce317eebabbd",
    "pr_number": 48,
    "pr_url": "https://github.com/H234598/ADHS-Lernpfad/pull/48",
    "workflow_run": null
  },
  "metrics": {
    "unit_number": 18,
    "planned_topic": "Trauma, PTBS und komplexe Traumafolgen",
    "flow_words": 1666,
    "new_reference_cards": 4,
    "unrelated_open_pull_requests": [43, 46],
    "automatic_unit_pull_request_open": true,
    "research_sources_selected": 4
  },
  "artifacts": [
    {
      "type": "branch",
      "value": "agent/einheit-18-trauma-ptbs-komplexe-traumafolgen",
      "path": null,
      "url": "https://github.com/H234598/ADHS-Lernpfad/tree/agent/einheit-18-trauma-ptbs-komplexe-traumafolgen",
      "sha256": null,
      "reusable": true,
      "recorded_at": "2026-08-02T04:35:00.000Z"
    },
    {
      "type": "commit",
      "value": "158957f90496c56cd91b60f96c52ce317eebabbd",
      "path": null,
      "url": "https://github.com/H234598/ADHS-Lernpfad/commit/158957f90496c56cd91b60f96c52ce317eebabbd",
      "sha256": null,
      "reusable": true,
      "recorded_at": "2026-08-02T04:45:00.000Z"
    },
    {
      "type": "pull_request",
      "value": "#48",
      "path": null,
      "url": "https://github.com/H234598/ADHS-Lernpfad/pull/48",
      "sha256": null,
      "reusable": true,
      "recorded_at": "2026-08-02T04:45:00.000Z"
    }
  ],
  "error": null,
  "recovery": null
}
